MINOR;BUG;10;371;При локализации параметра "ИмяСобытия" для получения кода языка следует использовать функцию ОбщегоНазначенияКлиентСервер.КодОсновногоЯзыка().
MINOR;BUG;10;374;Сообщение содержит восклицательный знак.
MAJOR;BUG;3;375;Избыточно установлены права на устаревший объект метаданных (с префиксом "Удалить").
MAJOR;CODE_SMELL;3;376;Превышена максимальная длина числовых данных (31 знак).
MAJOR;CODE_SMELL;3;377;Превышена максимальная длина ресурса регистра накопления или бухгалтерии (25 знаков).
MAJOR;CODE_SMELL;3;379;В качестве правого операнда операции сравнения "ПОДОБНО" указано поле таблицы.
MAJOR;BUG;3;380;Длина индекса составляет больше 900 байт.
MAJOR;BUG;3;381;Длина имени объекта метаданных превышает 80 символов.
MAJOR;CODE_SMELL;3;384;Установлено нулевое поле у табличного документа
INFO;CODE_SMELL;3;386;В свойствах формы настроено условное оформление.
INFO;CODE_SMELL;3;387;В свойствах динамического списка настроено условное оформление.
MAJOR;BUG;3;388;Неэкспортная процедура (функция) в разделе "ПрограммныйИнтерфейс".
MAJOR;BUG;3;389;Неэкспортная процедура (функция) в разделе "СлужебныйПрограммныйИнтерфейс".
MAJOR;CODE_SMELL;3;393;Использована ролевая настройка просмотра для реквизита формы.
MAJOR;CODE_SMELL;3;394;Использована ролевая настройка редактирования для реквизита формы.
MAJOR;BUG;3;395;Использована ролевая настройка использования для команды формы.
MAJOR;BUG;3;397;Не задан таймаут для объекта при работе с внешними ресурсами.
MAJOR;CODE_SMELL;3;398;Задан нулевой таймаут для объекта при работе с внешними ресурсами.
MAJOR;BUG;3;399;Отсутствует или неверно описана секция "Параметры" в комментарии к экспортной процедуре (функции).
MAJOR;BUG;3;400;Отсутствует или неверно описана секция "Возвращаемое значение" в комментарии к экспортной функции.
MAJOR;BUG;3;401;Не описаны некоторые параметры в секции "Параметры" в комментарии к экспортной процедуре (функции).
MAJOR;CODE_SMELL;3;402;Секция "Возвращаемое значение" находится перед секцией "Параметры" в комментарии к экспортной функции.
MAJOR;BUG;3;403;Некорректно оформлена гиперссылка "См. ..." в комментарии к экспортной процедуре (функции).
MAJOR;BUG;3;404;Не найден объект переадресации из гиперссылки "См. ..." в комментарии к экспортной процедуре (функции).
MAJOR;BUG;3;405;Описаны лишние параметры в секции "Параметры" в комментарии к экспортной процедуре (функции).
MAJOR;BUG;10;406;Некорректно описаны некоторые параметры в секции "Параметры" в комментарии к экспортной процедуре (функции).
MAJOR;BUG;10;407;Некорректно описан тип некоторых параметров в секции "Параметры" в комментарии к экспортной процедуре (функции).
MAJOR;CODE_SMELL;3;408;Описание параметров в секции "Параметры" должно начинаться с новой строки в комментарии к экспортной процедуре (функции).
MINOR;BUG;10;409;Описание возвращаемого значения в секции "Возвращаемое значение" должно начинаться с новой строки в комментарии к экспортной функции.
MAJOR;CODE_SMELL;3;410;Описана секция "Параметры" в комментарии к экспортной процедуре (функции), не имеющей параметров.
MAJOR;BUG;10;412;Значение свойства "История выбора при вводе" у документа не равно "Не использовать".
MAJOR;CODE_SMELL;3;413;Присутствует обработчик "ОбработкаПолученияДанныхВыбора", а свойство "История выбора при вводе" не равно "Не использовать".
MAJOR;BUG;10;414;Неверно установлены свойства поля формы, которое ссылается на объект метаданных с отключенной историей выбора при вводе.
MAJOR;CODE_SMELL;3;415;Нарушена схема работы с транзакциями: отличаются условия "Если ... Тогда" у методов работы с транзакциями.
MAJOR;BUG;3;416;Отсутствует или некорректно описан тип возвращаемого значения в комментарии к экспортной функции.
MAJOR;BUG;10;417;Некорректно описан тип некоторых свойств возвращаемого значения в комментарии к экспортной функции.
MAJOR;CODE_SMELL;3;419;В правах роли установлены ограничения (RLS) для объекта метаданных.
CRITICAL;BUG;20;420;В праве "Удаление" роли установлены ограничения (RLS) для объекта метаданных.
MAJOR;CODE_SMELL;3;421;Права на константу установлены в обеих ролях: "Полные права" и "Администратор системы".
CRITICAL;BUG;20;422;Права на константу не установлены ни в одной из ролей: "Полные права" и "Администратор системы".
MAJOR;CODE_SMELL;3;423;Для роли "Изменение<ИмяКонстанты>" установлены права на другой объект метаданных.
MAJOR;CODE_SMELL;3;424;Для роли "Чтение<ИмяКонстанты>" установлены права на другой объект метаданных.
MAJOR;BUG;10;425;Отсутствует область "ОписаниеПеременных" в тексте модуля.
MAJOR;CODE_SMELL;3;426;Переменная объявлена в области, содержащей процедуру или функцию.
MAJOR;CODE_SMELL;3;427;Отсутствует область "Инициализация" в тексте модуля.
MAJOR;CODE_SMELL;3;428;Операторы раздела инициализации расположены в области, содержащей процедуры или функции.
MAJOR;CODE_SMELL;3;429;Переменная объявлена вне области "ОписаниеПеременных".
MAJOR;CODE_SMELL;3;430;Операторы раздела инициализации расположены вне области "Инициализация".
MAJOR;BUG;10;433;Неэкспортная переменная не используется в модуле.
CRITICAL;BUG;10;435;Возврат константы типа Строка в модуле с повторным использованием.
MAJOR;CODE_SMELL;3;436;Возврат константы типа Число в модуле с повторным использованием.
MAJOR;CODE_SMELL;3;437;Возврат константы типа Дата в модуле с повторным использованием.
CRITICAL;BUG;10;438;Возврат константы типа Булево в модуле с повторным использованием.
MAJOR;CODE_SMELL;3;439;Возврат предопределенного элемента в модуле с повторным использованием.
CRITICAL;BUG;10;441;Отсутствует удаление временного файла после использования.
MAJOR;CODE_SMELL;3;442;Ошибка выполнения проверки: не удалось получить версию БСП.
MAJOR;CODE_SMELL;3;443;Ошибка выполнения проверки: не удалось получить назначение ролей пользователей.
MAJOR;BUG;10;444;Экспортная процедура в модуле с повторным использованием.
MINOR;BUG;10;445;В реквизит формы присвоена нелокализованная строка.
MINOR;BUG;10;446;У элемента формы не заполнен заголовок.
MINOR;BUG;10;447;У элемента формы бессмысленная подсказка.
MINOR;BUG;10;448;У элемента формы с заполненным списком выбора отключено свойство "Режим выбора из списка".
MINOR;BUG;10;449;Задано наименование предопределенного регламентного задания.
MAJOR;CODE_SMELL;3;450;В макете используется кодировка, отличная от "UTF-8".
MAJOR;CODE_SMELL;3;453;Обращение к менеджеру регламентных заданий при наличии подсистемы "Технология сервиса".
MAJOR;CODE_SMELL;3;454;Регламентное задание включено в состав разделителя.
MAJOR;CODE_SMELL;3;455;Регламентное задание с включенным использованием отсутствует в процедуре "ОчередьЗаданийПереопределяемый.ПриПолученииСпискаШаблонов".
MAJOR;CODE_SMELL;3;457;Использована ролевая настройка видимости в командном интерфейсе конфигурации.
MAJOR;CODE_SMELL;3;458;Устаревшая процедура (функция) расположена вне области "УстаревшиеПроцедурыИФункции".
MAJOR;BUG;10;459;Описание процедуры (функции) размещено в середине, а не в начале комментария; либо описание параметра без отступа.
MAJOR;CODE_SMELL;3;460;Использована ролевая настройка видимости в рабочей области начальной страницы.
MAJOR;CODE_SMELL;3;461;Использована ролевая настройка видимости в командном интерфейсе основного раздела.
MAJOR;CODE_SMELL;3;462;Для строковой константы запроса СКД не установлено представление доступного значения.
MINOR;BUG;10;463;Строковая константа в запросе СКД не соответствует правилам образования имен переменных.
MINOR;BUG;10;464;Не заполнен заголовок поля динамического списка.
MINOR;BUG;10;465;Не заполнен заголовок поля выборки в запросе СКД.
MAJOR;BUG;10;466;Нестандартные секции в описании экспортной процедуры (функции).
MAJOR;CODE_SMELL;3;467;Использование монопольного или оперативного обработчика обновления.
MAJOR;BUG;30;468;Экспортная процедура (функция) в области "ПрограммныйИнтерфейс" в общем модуле с повторным использованием.
MAJOR;CODE_SMELL;3;469;В служебном общем модуле присутствует область "ПрограммныйИнтерфейс".
MAJOR;CODE_SMELL;3;470;Превышена максимальная длина числовых данных в запросе (31 знак).
CRITICAL;BUG;30;472;Небезопасное подключение внешних компонент.
MAJOR;CODE_SMELL;3;473;Область "ДляВызоваИзДругихПодсистем" не входит в область "ПрограммныйИнтерфейс".
MAJOR;CODE_SMELL;3;474;В комментарии внутри области "ДляВызоваИзДругихПодсистем" не указана подсистема-потребитель.
MAJOR;CODE_SMELL;3;475;В комментарии внутри области "ДляВызоваИзДругихПодсистем" указана несуществующая подсистема.
MAJOR;CODE_SMELL;3;476;Внутри области "ДляВызоваИзДругихПодсистем" не найден закрывающий комментарий "// Конец ... <имя подсистемы-потребителя>".
CRITICAL;BUG;20;478;Нарушена схема работы с транзакциями: между "Исключение" и "ОтменитьТранзакцию()" есть исполняемый код.
MAJOR;CODE_SMELL;3;482;Запрос динамического списка, не содержащий секции "ИЗ", не переопределен в модуле формы.
MAJOR;BUG;3;483;Псевдоним таблицы запроса динамического списка, переопределяемого программно, не заканчивается постфиксом "Переопределяемый".
MAJOR;BUG;3;484;Программная установка свойств динамического списка выполняется без помощи процедуры "ОбщегоНазначения.УстановитьСвойстваДинамическогоСписка()".
CRITICAL;VULNERABILITY;30;486;Отсутствует включение безопасного режима перед вызовом метода "Выполнить" или "Вычислить".
MAJOR;BUG;3;487;Обнаружен вызов метода "Выполнить" вместо "ОбщегоНазначения.ВыполнитьВБезопасномРежиме()".
MAJOR;BUG;3;488;Обнаружен вызов метода "Вычислить" вместо "ОбщегоНазначения.ВычислитьВБезопасномРежиме()".
MAJOR;CODE_SMELL;3;489;Обнаружен вызов метода "Выполнить" вместо "РаботаВБезопасномРежиме.ВыполнитьВБезопасномРежиме()".
MAJOR;CODE_SMELL;3;490;Обнаружен вызов метода "Вычислить" вместо "РаботаВБезопасномРежиме.ВычислитьВБезопасномРежиме()".
MAJOR;CODE_SMELL;3;491;Некорректная локализация фрагмента текста запроса.
MAJOR;BUG;3;492;Неверно задан именованный параметр подстановки.
MAJOR;BUG;3;494;Использование запроса, выполняющего соединение с вложенным запросом.
MAJOR;BUG;3;495;Вызов функции "КаталогВременныхФайлов()".
CRITICAL;BUG;10;496;Не заполнен параметр "РегламентноеЗадание" при вызове процедуры "ОбщегоНазначения.ПриНачалеВыполненияРегламентногоЗадания();".
MAJOR;BUG;3;497;В имени макета отсутствует суффикс (например, "_ru").
MAJOR;BUG;30;499;Процедура переопределяемого общего модуля содержит лишний код (должен быть только код вида "<ИмяМодуля>.<ИмяПроцедуры>(<Параметры>);").
INFO;CODE_SMELL;3;500;Имя вызываемой процедуры отличается от имени переопределяемой процедуры.
INFO;CODE_SMELL;3;501;Отличается состав или порядок параметров вызываемой и переопределяемой процедуры.
INFO;CODE_SMELL;3;502;Неверный комментарий у процедуры, вызываемой в переопределяемом модуле (должен быть "См. <ПереопределяемыйМодуль>.<ПереопределяемаяПроцедура>.").
INFO;CODE_SMELL;20;503;В переопределяемом общем модуле описана функция.
INFO;CODE_SMELL;3;505;В переопределяемом общем модуле описана неэкспортная процедура (функция).
INFO;CODE_SMELL;5;506;В переопределяемом общем модуле описана лишняя внешняя область (должна быть только область "ПрограммныйИнтерфейс").
MINOR;BUG;20;507;Роль дает права на объекты других подсистем.
MAJOR;BUG;10;508;Неверно заданы права на обработку (должны быть у ИспользованиеОбработки<ИмяОбработки>, БазовыеПрава<ИмяБиблиотеки> или Подсистема<ИмяПодсистемы>).
MAJOR;CODE_SMELL;3;510;Ни в одной роли нет прав на просмотр команды.
MAJOR;BUG;10;511;Неверно заданы права на команду (есть права на просмотр команды, но нет прав на чтение или просмотр объекта).
MAJOR;CODE_SMELL;3;512;Неверно заданы права на команду (есть права на чтение или просмотр объекта, но нет прав на просмотр команды).
MAJOR;CODE_SMELL;3;513;Неверно заданы права на команду (права на команды печати должны быть назначены роли "БазовыеПрава<ИмяБиблиотеки>").
MAJOR;BUG;10;514;Роль не дает прав ни на один объект метаданных, и к ней нет обращения в коде модулей.
MAJOR;CODE_SMELL;3;515;Использована функция "Пользователи.РолиДоступны()".
MAJOR;CODE_SMELL;3;518;Планом обмена поддерживается версия формата обмена EnterpriseData, не входящая в состав конфигурации.
MAJOR;CODE_SMELL;3;519;Планом обмена не поддерживается более высокая версия формата обмена EnterpriseData.
INFO;CODE_SMELL;3;520;Планом обмена не поддерживается более низкая версия формата обмена EnterpriseData.
CRITICAL;BUG;10;521;Нарушена схема работы с транзакциями: преждевременный выход из блока "Попытка..Исключение" без завершения или отмены транзакции.
CRITICAL;BUG;10;524;Некорректно заполнено свойство "Путь к данным" у поля динамического списка.
MAJOR;CODE_SMELL;3;525;Некорректно заполнено свойство "Данные" у кнопки, связанной с полем динамического списка.
MINOR;BUG;5;526;У процедуры (функции) в модуле формы отсутствует директива компиляции.
CRITICAL;BUG;5;527;В качестве параметра обработчика оповещения указана серверная процедура.
MAJOR;CODE_SMELL;3;529;Для объекта метаданных назначено несколько отложенных обработчиков обновления в параллельном режиме.
MAJOR;CODE_SMELL;3;530;Отложенный обработчик обновления в параллельном режиме для объекта одной подсистемы обрабатывает данные другой подсистемы.
INFO;CODE_SMELL;3;531;Избыточное обращение внутри модуля через его имя или псевдоним ЭтотОбъект (к методу, свойству или реквизиту).
MAJOR;BUG;3;534;Небезопасный запуск приложения.
MAJOR;CODE_SMELL;3;536;Отсутствует отключение макросов при работе с документом Microsoft Word.
MAJOR;CODE_SMELL;3;537;Отсутствует отключение макросов при работе с документом Microsoft Excel.
INFO;CODE_SMELL;10;538;Объект, не имеющий визуального представления, входит в состав подсистемы, включенной в командный интерфейс.
INFO;CODE_SMELL;3;540;В запросе отсутствует проверка на NULL для поля, которое может потенциально содержать NULL.
MAJOR;BUG;3;541;Неверно установлены права базовой роли на объект метаданных.
MAJOR;CODE_SMELL;3;543;В отложенном обработчике обновления не указан идентификатор.
MAJOR;CODE_SMELL;3;544;В отложенном обработчике обновления не указан комментарий.
MAJOR;CODE_SMELL;3;545;В отложенном обработчике обновления обнаружен неуникальный идентификатор.
MAJOR;CODE_SMELL;3;546;В отложенном обработчике обновления обнаружен неуникальный комментарий.
MINOR;BUG;30;547;Использована инструкция препроцессора в клиент-серверном общем модуле.
INFO;CODE_SMELL;10;548;Параметры вызова функции скопированы из определения вызываемой процедуры (функции).
INFO;CODE_SMELL;3;549;Выполняется неявная передача обязательного параметра.
CRITICAL;BUG;20;552;Небезопасное подключение внешней обработки.
CRITICAL;BUG;20;553;Небезопасное подключение внешнего отчета.
MAJOR;CODE_SMELL;3;554;Небезопасное подключение расширения конфигурации.
MAJOR;CODE_SMELL;3;555;Создание объекта типа "ОписаниеЗащитыОтОпасныхДействий".
CRITICAL;BUG;30;556;Вызов функции БСП "ОбщегоНазначения.ОписаниеЗащитыБезПредупреждений()".
MAJOR;BUG;20;557;Экспортная процедура (функция) из модуля с признаком "ВызовСервера" не вызывается на клиенте.
MAJOR;BUG;20;558;Экспортная процедура (функция) из модуля с признаком "КлиентСервер" не вызывается на клиенте.
MAJOR;BUG;20;559;Экспортная процедура (функция) из модуля с признаком "КлиентСервер" не вызывается на сервере.
BLOCKER;BUG;30;561;Ошибка платформенной проверки конфигурации.
BLOCKER;BUG;30;562;Ошибка платформенной проверки конфигурации: Возможно ошибочное свойство.
BLOCKER;BUG;30;563;Ошибка платформенной проверки конфигурации: Возможно ошибочный метод.
BLOCKER;BUG;30;564;Ошибка платформенной проверки конфигурации: Возможно ошибочный параметр.
CRITICAL;BUG;20;565;Ошибка платформенной проверки конфигурации: Использование модального вызова.
BLOCKER;BUG;30;566;Ошибка платформенной проверки конфигурации: Использование синхронного вызова.
